{"artifacts":[{"digest":{"sha256":"ecd821dbe6f4204c4aad64878643d7954cb8c94abbf8d0b28f9c2bfc272f781e"},"path":"artifacts/final/71895faa8bce0d0426b2e447bb12d15e50e9f9d27135ebabbb94bc9d59426d4e.bin","statementDigest":{"sha256":"99aee76db46a720405da6d0015d427c791b0d4e02367b9e2bc36ce82ae812bce"},"subjectName":"customers.public.json"}],"attestations":[{"path":"attestations/1f28b72bcd4c1e9b7df71403ac6bb1670c2f2b09628ca6d76a2fa384db9a0848.dsse.json","statementDigest":{"sha256":"1f28b72bcd4c1e9b7df71403ac6bb1670c2f2b09628ca6d76a2fa384db9a0848"}},{"path":"attestations/56b7be4394fe09c62ec7a3d5763cecc251e9696f267f35b2acc717b0d170a27a.dsse.json","statementDigest":{"sha256":"56b7be4394fe09c62ec7a3d5763cecc251e9696f267f35b2acc717b0d170a27a"}},{"path":"attestations/99aee76db46a720405da6d0015d427c791b0d4e02367b9e2bc36ce82ae812bce.dsse.json","statementDigest":{"sha256":"99aee76db46a720405da6d0015d427c791b0d4e02367b9e2bc36ce82ae812bce"}}],"datasetEntries":[],"manifest":"manifest.dsse.json","schemaCatalog":"schemas/catalog.json","version":"0.2"}
