{"artifacts":[{"digest":{"sha256":"2f4fe11d8b533357fa0fdb890f1a714047393c962d75c8dd8cbb009e01fbd9f4"},"path":"artifacts/final/74ca1fffa13e171a10e838cf6a1516167ae8de5420f331974d0bcbdc7f67db76.bin","statementDigest":{"sha256":"962be71738a0146642d27c87fba3c7338b0f2bb764b113b16867bb4808b11977"},"subjectName":"customers.public.json"}],"attestations":[{"path":"attestations/1f28b72bcd4c1e9b7df71403ac6bb1670c2f2b09628ca6d76a2fa384db9a0848.dsse.json","statementDigest":{"sha256":"1f28b72bcd4c1e9b7df71403ac6bb1670c2f2b09628ca6d76a2fa384db9a0848"}},{"path":"attestations/56b7be4394fe09c62ec7a3d5763cecc251e9696f267f35b2acc717b0d170a27a.dsse.json","statementDigest":{"sha256":"56b7be4394fe09c62ec7a3d5763cecc251e9696f267f35b2acc717b0d170a27a"}},{"path":"attestations/962be71738a0146642d27c87fba3c7338b0f2bb764b113b16867bb4808b11977.dsse.json","statementDigest":{"sha256":"962be71738a0146642d27c87fba3c7338b0f2bb764b113b16867bb4808b11977"}}],"datasetEntries":[],"manifest":"manifest.dsse.json","schemaCatalog":"schemas/catalog.json","version":"0.2"}
